[
  {
    "id": "eng-grammar-basic-0001",
    "subject": "english",
    "topic": "grammar-basic",
    "difficulty": 1,
    "type": "mc",
    "tags": ["tense", "present"],
    "question": "She _____ to school every day.",
    "choices": ["go", "goes", "going", "gone"],
    "answer": 1,
    "explanation": "主語がSheの場合、現在形の動詞には三単現のsを付けます。",
    "active": true
  },
  {
    "id": "eng-grammar-basic-0002",
    "subject": "english",
    "topic": "grammar-basic",
    "difficulty": 1,
    "type": "mc",
    "tags": ["tense", "past"],
    "question": "I _____ a movie yesterday.",
    "choices": ["watch", "watched", "watching", "will watch"],
    "answer": 1,
    "explanation": "yesterdayがあるので過去形watchedを使います。",
    "active": true
  },
  {
    "id": "eng-grammar-basic-0003",
    "subject": "english",
    "topic": "grammar-basic",
    "difficulty": 1,
    "type": "mc",
    "tags": ["auxiliary", "can"],
    "question": "_____ you help me with this problem?",
    "choices": ["Should", "Will", "Must", "Can"],
    "answer": 3,
    "explanation": "依頼を表すCanが最も適切です。「～してもらえますか？」",
    "active": true
  },
  {
    "id": "eng-grammar-basic-0004",
    "subject": "english",
    "topic": "grammar-basic",
    "difficulty": 2,
    "type": "mc",
    "tags": ["auxiliary", "should"],
    "question": "You _____ study harder if you want to pass the exam.",
    "choices": ["can", "should", "will", "may"],
    "answer": 1,
    "explanation": "「～すべきだ」という助言・勧告を表すshouldが適切です。",
    "active": true
  },
  {
    "id": "eng-grammar-basic-0005",
    "subject": "english",
    "topic": "grammar-basic",
    "difficulty": 2,
    "type": "mc",
    "tags": ["passive", "present"],
    "question": "This book _____ by many students.",
    "choices": ["reads", "is read", "was reading", "read"],
    "answer": 1,
    "explanation": "「この本は読まれる」受動態はbe + 過去分詞で表します。",
    "active": true
  },
  {
    "id": "eng-grammar-basic-0006",
    "subject": "english",
    "topic": "grammar-basic",
    "difficulty": 2,
    "type": "mc",
    "tags": ["passive", "past"],
    "question": "The house _____ last year.",
    "choices": ["built", "was built", "is built", "builds"],
    "answer": 1,
    "explanation": "last yearがあるので過去の受動態was builtが正解です。",
    "active": true
  },
  {
    "id": "eng-grammar-basic-0007",
    "subject": "english",
    "topic": "grammar-basic",
    "difficulty": 1,
    "type": "mc",
    "tags": ["infinitive", "want"],
    "question": "I want _____ English fluently.",
    "choices": ["speak", "to speak", "speaking", "spoke"],
    "answer": 1,
    "explanation": "want to do「～したい」の構文です。",
    "active": true
  },
  {
    "id": "eng-grammar-basic-0008",
    "subject": "english",
    "topic": "grammar-basic",
    "difficulty": 2,
    "type": "mc",
    "tags": ["infinitive", "it-to"],
    "question": "It is important _____ early.",
    "choices": ["get up", "to get up", "getting up", "got up"],
    "answer": 1,
    "explanation": "It is + 形容詞 + to do の構文です。",
    "active": true
  },
  {
    "id": "eng-grammar-basic-0009",
    "subject": "english",
    "topic": "grammar-basic",
    "difficulty": 2,
    "type": "mc",
    "tags": ["tense", "present-perfect"],
    "question": "I _____ this book before.",
    "choices": ["read", "have read", "was reading", "will read"],
    "answer": 1,
    "explanation": "beforeがあるので経験を表す現在完了形have readを使います。",
    "active": true
  },
  {
    "id": "eng-grammar-basic-0010",
    "subject": "english",
    "topic": "grammar-basic",
    "difficulty": 3,
    "type": "mc",
    "tags": ["conditional", "if"],
    "question": "If it _____ tomorrow, we will stay home.",
    "choices": ["rain", "rains", "will rain", "rained"],
    "answer": 1,
    "explanation": "If節では未来のことでも現在形を使います。主節がwillなので条件節は現在形。",
    "active": true
  },
  {
    "id": "eng-grammar-basic-0011",
    "subject": "english",
    "topic": "grammar-basic",
    "difficulty": 3,
    "type": "mc",
    "tags": ["relative", "who"],
    "question": "The man _____ is standing there is my teacher.",
    "choices": ["which", "who", "whom", "whose"],
    "answer": 1,
    "explanation": "人を先行詞とする関係代詞の主格はwhoを使います。",
    "active": true
  },
  {
    "id": "eng-grammar-basic-0012",
    "subject": "english",
    "topic": "grammar-basic",
    "difficulty": 2,
    "type": "mc",
    "tags": ["gerund", "enjoy"],
    "question": "She enjoys _____ music.",
    "choices": ["listen", "to listen", "listening", "listened"],
    "answer": 2,
    "explanation": "enjoyは動名詞を目的語にとります。enjoy doing",
    "active": true
  },
  {
    "id": "eng-grammar-basic-0013",
    "subject": "english",
    "topic": "grammar-basic",
    "difficulty": 3,
    "type": "mc",
    "tags": ["comparison", "than"],
    "question": "This book is _____ than that one.",
    "choices": ["interesting", "more interesting", "most interesting", "interestinger"],
    "answer": 1,
    "explanation": "比較級はmore + 形容詞またはer形。interestingは長い形容詞なのでmore interesting。",
    "active": true
  },
  {
    "id": "eng-grammar-basic-0014",
    "subject": "english",
    "topic": "grammar-basic",
    "difficulty": 2,
    "type": "mc",
    "tags": ["preposition", "time"],
    "question": "I will meet you _____ 3 o'clock.",
    "choices": ["in", "on", "at", "by"],
    "answer": 2,
    "explanation": "時刻を表すときはat を使います。at 3 o'clock",
    "active": true
  },
  {
    "id": "eng-grammar-basic-0015",
    "subject": "english",
    "topic": "grammar-basic",
    "difficulty": 3,
    "type": "mc",
    "tags": ["subjunctive", "wish"],
    "question": "I wish I _____ speak Chinese.",
    "choices": ["can", "could", "will", "would"],
    "answer": 1,
    "explanation": "I wish + 仮定法過去で現在の事実と反対の願望を表します。canの仮定法過去はcould。",
    "active": true
  }
]